<?xml version="1.0"?>
<!-- edited with XML Spy v4.3 U (http://www.xmlspy.com) by Daniele Colecchia (TXT e-solutions s.p.a.) -->
<!DOCTYPE JOINS SYSTEM "../joins.dtd">
<JOINS>
    <JOIN>
        <JOIN_ID>1</JOIN_ID>
        <DBTABLEA>TP_PLANT</DBTABLEA>
        <DBTABLEB>TP_HISTORY</DBTABLEB>
        <JOINFLDA>JOBNAME</JOINFLDA>
        <JOINFLDB>JOBNAME</JOINFLDB>
    </JOIN>
    <JOIN>
        <JOIN_ID>1</JOIN_ID>
        <DBTABLEA>TP_PLANT</DBTABLEA>
        <DBTABLEB>TP_HISTORY</DBTABLEB>
        <JOINFLDA>JOB_RELEASE</JOINFLDA>
        <JOINFLDB>JOB_RELEASE</JOINFLDB>
    </JOIN>
    <JOIN>
        <JOIN_ID>1</JOIN_ID>
        <DBTABLEA>TP_PLANT</DBTABLEA>
        <DBTABLEB>TP_HISTORY</DBTABLEB>
        <JOINFLDA>JOB_REVISION</JOINFLDA>
        <JOINFLDB>JOB_REVISION</JOINFLDB>
    </JOIN>
    <JOIN>
        <JOIN_ID>1</JOIN_ID>
        <DBTABLEA>TP_PLANT</DBTABLEA>
        <DBTABLEB>TP_HISTORY</DBTABLEB>
        <JOINFLDA>TPMS_VER</JOINFLDA>
        <JOINFLDB>TPMS_VER</JOINFLDB>
    </JOIN>
    <!--tp comments-->
    <JOIN>
        <JOIN_ID>1</JOIN_ID>
        <DBTABLEA>TP_PLANT</DBTABLEA>
        <DBTABLEB>TP_COMMENTS</DBTABLEB>
        <JOINFLDA>JOBNAME</JOINFLDA>
        <JOINFLDB>JOBNAME</JOINFLDB>
    </JOIN>
    <JOIN>
        <JOIN_ID>1</JOIN_ID>
        <DBTABLEA>TP_PLANT</DBTABLEA>
        <DBTABLEB>TP_COMMENTS</DBTABLEB>
        <JOINFLDA>JOB_RELEASE</JOINFLDA>
        <JOINFLDB>JOB_RELEASE</JOINFLDB>
    </JOIN>
    <JOIN>
        <JOIN_ID>1</JOIN_ID>
        <DBTABLEA>TP_PLANT</DBTABLEA>
        <DBTABLEB>TP_COMMENTS</DBTABLEB>
        <JOINFLDA>JOB_REVISION</JOINFLDA>
        <JOINFLDB>JOB_REVISION</JOINFLDB>
    </JOIN>
</JOINS>
